{
  "schema_version": "1.0.0",
  "session_id": "sess_l7_0001",
  "objective_id": "obj_l7_prompt_map",
  "created_at": "2026-02-06T10:46:34Z",
  "status": "SUCCESS",
  "output_artifact_refs": [
    {
      "name": "candidates_prompt",
      "path": "/home/ljhljh/project i3/examples/l7_run_output/candidates_prompt.json"
    },
    {
      "name": "evaluation_report_prompt",
      "path": "/home/ljhljh/project i3/examples/l7_run_output/evaluation_report_prompt.json"
    },
    {
      "name": "selection_trace_prompt",
      "path": "/home/ljhljh/project i3/examples/l7_run_output/selection_trace_prompt.json"
    },
    {
      "name": "continuity_audit_prompt",
      "path": "/home/ljhljh/project i3/examples/l7_run_output/continuity_audit_prompt.json"
    },
    {
      "name": "prompt_map_pack",
      "path": "/home/ljhljh/project i3/examples/l7_run_output/prompt_map_pack.json"
    },
    {
      "name": "scenes_v2",
      "path": "/home/ljhljh/project i3/examples/l7_run_output/scenes_v2.json"
    },
    {
      "name": "runtime_log_l7",
      "path": "/home/ljhljh/project i3/examples/l7_run_output/runtime_log_l7.json"
    }
  ],
  "metrics": {
    "scene_count": 5,
    "candidate_count": 15,
    "pass_threshold_scene_count": 3,
    "flagged_scene_count": 5,
    "revised_scene_count": 5
  }
}
