{
  "schema_version": "1.0.0",
  "session_id": "sess_l1_0001",
  "objective_id": "obj_l1_research",
  "created_at": "2026-02-06T03:45:57Z",
  "status": "SUCCESS",
  "output_artifact_refs": [
    {
      "name": "topic_research_bundle",
      "path": "/home/dlwhdgus/project i3/examples/l1_run_output/topic_research_bundle.json"
    },
    {
      "name": "claim_verification_report",
      "path": "/home/dlwhdgus/project i3/examples/l1_run_output/claim_verification_report.json"
    },
    {
      "name": "evaluation_report_topic_intake",
      "path": "/home/dlwhdgus/project i3/examples/l1_run_output/evaluation_report_topic_intake.json"
    },
    {
      "name": "selection_trace_topic_intake",
      "path": "/home/dlwhdgus/project i3/examples/l1_run_output/selection_trace_topic_intake.json"
    }
  ],
  "metrics": {
    "candidate_count": 1,
    "verified_claim_count": 1,
    "selected_candidate_id": "cand_all"
  }
}
