{
  "schema_version": "1.0.0",
  "session_id": "sess_l1_0001",
  "objective_id": "obj_l1_research",
  "created_at": "2026-02-06T12:10:00Z",
  "status": "SUCCESS",
  "output_artifact_refs": [
    {
      "name": "topic_research_bundle",
      "path": "examples/artifacts/sample_topic_research_bundle.json"
    }
  ],
  "metrics": {
    "claims_total": 2,
    "claims_verified": 2
  }
}
